created_at;id_str;full_text;quote_count;reply_count;retweet_count;favorite_count;lang;user_id_str;conversation_id_str;username;tweet_url
Fri Jan 29 13:05:32 +0000 2021;1355140018008969223;"Pelaksanaan vaksinasi COVID-19 nakes di Surabaya masih terus dilakukan. Namun ada beberapa dokter yang belum mendapat vaksin. Rencananya dilakukan 31 Januari. https://t.co/Q7RIRNe6KI";0;0;2;4;in;69183155;1355140018008969223;detikcom;https://twitter.com/detikcom/status/1355140018008969223
Fri Jan 29 12:19:52 +0000 2021;1355128528233140229;"Sudah 80 Persen Nakes Surabaya Sudah Terima Vaksin Covid-19 https://t.co/rn4Cnp7d0y";0;0;0;0;in;2392460208;1355128528233140229;jawapos;https://twitter.com/jawapos/status/1355128528233140229
Fri Jan 29 06:33:50 +0000 2021;1355041442859606017;"Halo semuanya!  Pelaksana Tugas (Plt) Wali Kota Surabaya, Whisnu Sakti Buana, bersama dengan Forkopimda Surabaya menerima vaksin Covid-19 yang kedua hari ini, Jumat (29/1) di lobby lantai 2 Balai Kota Surabaya  Ini adalah lanjutan dr vaksinasi pertama pada Jumat (15/1) lalu https://t.co/pPIyruqOvr";0;2;8;19;in;288692148;1355041442859606017;SapawargaSby;https://twitter.com/SapawargaSby/status/1355041442859606017
Thu Jan 28 10:31:30 +0000 2021;1354738867203567621;"Berbeda dengan vaksinasi Covid-19 sebelumnya 14 Januari 2021 lalu dilaksanakan di Gedung Negara Grahadi, kali ini kegiatan pemberian vaksin tahap kedua digelar di kantor Gubernur Jawa Timur, Jalan Pahlawan 110 Surabaya.";0;1;0;0;in;888350689381842944;1354738864598904834;PolsekKandat;https://twitter.com/PolsekKandat/status/1354738867203567621
Thu Jan 28 02:33:10 +0000 2021;1354618492998172672;"Pemerintah Kota Surabaya kembali menerima alokasi vaksin Covid-19 untuk tahap 2 (27/01/2021)   Pendistribusian vaksin ke tiga ini mendapat pengawalan dari Polda Jawa Timur. https://t.co/rwqGiDIyy3";0;1;1;7;in;3042987860;1354618492998172672;satpolppsby;https://twitter.com/satpolppsby/status/1354618492998172672
Wed Jan 27 13:06:16 +0000 2021;1354415426877448192;"Dinkes Kota Surabaya kembali menerima 27.840 dosis vaksin COVID-19 yang didistribusikan Pemprov Jatim. Vaksin akan diberikan secara bertahap mulai 29 Januari. https://t.co/UFZvs7xXoF";1;0;1;4;in;69183155;1354415426877448192;detikcom;https://twitter.com/detikcom/status/1354415426877448192
Wed Jan 27 09:54:10 +0000 2021;1354367082964471808;"Pemkot Surabaya Terima 27.840 Dosis Vaksin Covid-19 untuk Vaksinasi Kedua https://t.co/sY3SsXu6mc";0;0;1;2;in;848614550;1354367082964471808;e100ss;https://twitter.com/e100ss/status/1354367082964471808
Wed Jan 27 09:49:44 +0000 2021;1354365969695608837;"Halo semuanya  Pemerintah Kota Surabaya kembali menerima vaksin COVID-19 pada hari Rabu (27/1), ini adalah distribusi ketiga vaksin ke Kota Surabaya   #SurabayaSiapVaksin https://t.co/8C9wdYLkEw";0;1;7;18;in;288692148;1354365969695608837;SapawargaSby;https://twitter.com/SapawargaSby/status/1354365969695608837
Wed Jan 27 06:37:23 +0000 2021;1354317561345699851;"Vaksin COVID-19 Kembali diterima Pemerintah Kota Surabaya.  #DulurSehatSby, Pemerintah Kota Surabaya kembali mendapatkan alokasi vaksin Covid-19 untuk tahap 2, hari ini (27/01/2021) https://t.co/KKINJRNWpv";0;2;11;35;in;1232843596342022144;1354317561345699851;sehatsurabayaku;https://twitter.com/sehatsurabayaku/status/1354317561345699851
Tue Jan 26 11:10:48 +0000 2021;1354023983985827840;"Petugas satlantas polres Nganjuk melaksanakan kegiatan pengawalan dan pengamanan kedatangan vaksin covid-19 dari surabaya menuju Kab. Nganjuk.  Kami Siap Menuju Indonesia Sehat.   AYO PATUH TERTIB BERLALU LINTAS 🚦🙏 DAN PATUH PROTOKOL KESEHATAN😷 https://t.co/mYm4maNpZO";0;0;0;3;in;1287635586631626757;1354023983985827840;lantasresngk;https://twitter.com/lantasresngk/status/1354023983985827840
Tue Jan 26 05:32:05 +0000 2021;1353938740691963905;"Vaksin Sinovac telah datang ke Kota Malang, Senin (25/1/2021), sekitar pukul 18.00. Sinovac sebanyak 10.240 dosis vaksin Covid-19 ini datang dari Surabaya langsung menuju ke kantor Dinas Kesehatan (Dinkes) Kota Malang. Rencananya, vaksin ini akan… https://t.co/i7VD7z4Jc6 https://t.co/bNyn4dt57o";0;0;0;1;in;2519948221;1353938740691963905;jatimtimescom;https://twitter.com/jatimtimescom/status/1353938740691963905
Tue Jan 26 03:02:37 +0000 2021;1353901127629066240;"Ribuan tenaga kesehatan (nakes) Surabaya secara bertahap mengikuti vaksinasi Covid-19. Sebagian besar dari mereka, tanpa merasakan efek samping usai disuntik vaksin. https://t.co/PdSZGZR0HF #surabaya #beritajatim";0;0;0;0;in;21287066;1353901127629066240;beritajatimcom;https://twitter.com/beritajatimcom/status/1353901127629066240
Mon Jan 25 12:05:53 +0000 2021;1353675456482926592;"Ribuan tenaga kesehatan Surabaya secara bertahap mengikuti vaksinasi COVID-19. Sebagian besar dari mereka, tanpa merasakan efek samping usai disuntik vaksin. https://t.co/iUylE1amqz";0;0;0;0;in;1186946650595418116;1353675456482926592;voidotid;https://twitter.com/voidotid/status/1353675456482926592
Sat Jan 23 02:35:24 +0000 2021;1352807115358789632;"Usai Disuntik Vaksin Covid-19 di Surabaya, 22 Orang Ini Alami Berbagai Macam Gejala https://t.co/Gix6Y6So8W";0;5;11;36;in;887743587579944960;1352807115358789632;OposisiCerdas;https://twitter.com/OposisiCerdas/status/1352807115358789632
Sat Jan 23 02:28:02 +0000 2021;1352805259094052864;"Pengawalan Pendistribusian Vaksin Covid-19 di Kota Surabaya  https://t.co/fpeF3qf50s   #PPKM  #PPKMSurabaya  #ProtokolKesehatan  #PolrestabesSurabaya #Polri #JogoSuroboyo #JogoJawaTimur  #HumasPolrestabesSurabaya";0;0;0;0;in;4188612492;1352805259094052864;PolrestabesSby;https://twitter.com/PolrestabesSby/status/1352805259094052864
Fri Jan 22 13:00:01 +0000 2021;1352601913888366601;"Demi mempercepat proses vaksinasi COVID-19 di wilayahnya, Pemkot Surabaya menambah fasilitas kesehatan yang melayani penyuntikan vaksin Sinovac.  Pemkot Surabaya Tambah Fasilitas Kesehatan untuk Vaksinasi COVID-19 https://t.co/NzbRmiJ4BW  #VaksinasiSurabaya #COVID19Surabaya https://t.co/QS98cyQrkA";0;0;0;0;in;1016858721056522240;1352601913888366601;PingPointID;https://twitter.com/PingPointID/status/1352601913888366601
Thu Jan 21 11:05:16 +0000 2021;1352210651620392963;"Baru 11 Persen Tenaga Kesehatan Suntik Vaksin Covid-19 di Surabaya https://t.co/MFgscC7AA8";0;0;0;0;in;2392460208;1352210651620392963;jawapos;https://twitter.com/jawapos/status/1352210651620392963
Thu Jan 21 07:10:04 +0000 2021;1352151461740769280;"Gudang Farmasi Tampung Seluruh Vaksin Covid-19 untuk Surabaya https://t.co/LjGZeUXbNF";0;0;0;2;in;2392460208;1352151461740769280;jawapos;https://twitter.com/jawapos/status/1352151461740769280
Wed Jan 20 14:03:00 +0000 2021;1351892989724020736;"2.301 tenaga kesehatan (nakes) di Surabaya telah disuntik vaksin Covid-19 pada tahap pertama ini. #COVID19 #COVIDー19 #COVID #kasuscovid #kasuscorona #CoronaVac  https://t.co/trsRntHQlk https://t.co/IcsYbfhPof";2;0;0;1;in;1052798082419580928;1351892989724020736;timescoid;https://twitter.com/timescoid/status/1351892989724020736
Wed Jan 20 12:40:20 +0000 2021;1351872187838316544;"Hampir setiap hari paling tidak sekitar 500 tenaga kesehatan divaksinasi di 109 fasilitas pelayanan kesehatan di Kota Surabaya. Hingga Rabu (20/1/2021), sudah 2.500 nakes disuntik vaksin Covid-19 pada gelombang pertama.   #Nusantara #adadikompas  https://t.co/pLcgvuQ53F";0;0;1;3;in;255866913;1351872187838316544;hariankompas;https://twitter.com/hariankompas/status/1351872187838316544
Wed Jan 20 11:15:52 +0000 2021;1351850930405306371;"DINKES Jatim Kembali Distribusikan Vaksin COVID-19 Sinovac Ke Surabaya Raya https://t.co/T13EapdWW7";0;0;0;0;in;3158354773;1351850930405306371;nawacitamedia;https://twitter.com/nawacitamedia/status/1351850930405306371
Wed Jan 20 09:48:10 +0000 2021;1351828858748604417;"Ribuan tenaga kesehatan (nakes) Surabaya telah disuntik vaksin COVID-19 pada gelombang pertama https://t.co/shBBzGzZH8";0;0;0;0;in;1186946650595418116;1351828858748604417;voidotid;https://twitter.com/voidotid/status/1351828858748604417
Wed Jan 20 09:44:54 +0000 2021;1351828037956820995;"Dinkes Jatim kembali distribusikan vaksin Covid-19 ke Surabaya Raya via @radiomercury96 https://t.co/pFK8j8BusW";0;0;0;0;in;102267519;1351828037956820995;radiomercury96;https://twitter.com/radiomercury96/status/1351828037956820995
Wed Jan 20 08:58:02 +0000 2021;1351816244731674625;"Dinkes Jatim Kembali Distribusikan Vaksin Covid-19 Sinovac ke Surabaya Raya https://t.co/KZDRWS7PEH #timesindonesia #ketahananinformasi #hariibu";0;0;0;0;in;1052798082419580928;1351816244731674625;timescoid;https://twitter.com/timescoid/status/1351816244731674625
Wed Jan 20 08:50:56 +0000 2021;1351814455408029699;"Tambahan Vaksin Covid-19 untuk Surabaya Terkirim Hari Ini https://t.co/VYlK5BcLbj";0;0;0;0;in;2392460208;1351814455408029699;jawapos;https://twitter.com/jawapos/status/1351814455408029699
Wed Jan 20 08:08:12 +0000 2021;1351803703032909828;"Menggenapi 15.000 dosis vaksin yang sebelumnya telah diterima oleh Pemkot Surabaya. Sehingga Surabaya mendapatkan vaksin COVID di tahap pertama ini sebanyak 33.420 dosis. https://t.co/SFOLMVZh3v";0;1;0;1;in;1232843596342022144;1351803592059994115;sehatsurabayaku;https://twitter.com/sehatsurabayaku/status/1351803703032909828
Wed Jan 20 08:07:56 +0000 2021;1351803636217765888;"Penanggung Jawab Instalasi Farmasi Kota Surabaya  Apt. Erwin Firman S., https://t.co/G9cJ9UyzHf. MFarm. Klin. menuturkan, sebanyak 18.420 dosis vaksin COVID-19 diterima dan disimpan di Instalasi Farmasi Kota Surabaya. https://t.co/kSNJg1F1lZ";0;1;0;1;in;1232843596342022144;1351803592059994115;sehatsurabayaku;https://twitter.com/sehatsurabayaku/status/1351803636217765888
Wed Jan 20 08:07:46 +0000 2021;1351803592059994115;"PENDISTRIBUSIAN VAKSIN COVID-19 TAHAP PERTAMA TERMIN KEDUA KE KOTA SURABAYA  #DulurSehatSby, Pemerintah Kota Surabaya kembali mendapatkan alokasi vaksin COVID-19 dari Dinas Kesehatan Jawa Timur, siang ini (20/02/2021). https://t.co/KDzd7xS6p6";1;3;20;36;in;1232843596342022144;1351803592059994115;sehatsurabayaku;https://twitter.com/sehatsurabayaku/status/1351803592059994115
Wed Jan 20 08:03:33 +0000 2021;1351802532801114112;"Dalam tahap pertama vaksinasi COVID-19 ini, Surabaya mendapatkan jatah sebanyak 33.420 vaksin. #publisherstory https://t.co/fYV18ih5FX";0;0;0;0;in;759692754985242625;1351802532801114112;kumparan;https://twitter.com/kumparan/status/1351802532801114112
Wed Jan 20 07:36:29 +0000 2021;1351795721104576512;"Dinkes Jatim Tuntaskan Distribusi Vaksin Covid-19 di Surabaya Raya https://t.co/PAz6u74Mdi";0;0;0;5;in;848614550;1351795721104576512;e100ss;https://twitter.com/e100ss/status/1351795721104576512
Tue Jan 19 20:12:04 +0000 2021;1351623481104998403;"Gelombang Pertama, 2.301 Tenaga Kesehatan di Surabaya Sudah Disuntik Vaksin Covid-19 https://t.co/SsEFsw3Mnh #peristiwa dan kalo belum puas, yuk baca berita lainnya di situs https://t.co/xeLAFysKe2 https://t.co/y4Kwfu5o5Y";0;0;0;0;in;1247169461611708422;1351623481104998403;dailymateradio;https://twitter.com/dailymateradio/status/1351623481104998403
Tue Jan 19 20:07:33 +0000 2021;1351622343416664064;"Gelombang Pertama, 2.301 Tenaga Kesehatan di Surabaya Sudah Disuntik Vaksin Covid-19 https://t.co/P9dVRUt9Bd https://t.co/vLPxtHYwO5";0;0;0;0;in;2251383210;1351622343416664064;AhmadNorMaulana;https://twitter.com/AhmadNorMaulana/status/1351622343416664064
Tue Jan 19 20:05:01 +0000 2021;1351621708063465472;"Gelombang Pertama, 2.301 Tenaga Kesehatan di Surabaya Sudah Disuntik Vaksin Covid-19: Ribuan nakes yang telah menerima vaksinasi itu bekerja di 109 Fasilitas Pelayanan Kesehatan (Fasyankes) yang tersebar se-Surabaya. https://t.co/1NluhwuN5t";0;0;0;2;in;456426648;1351621708063465472;merdekadotcom;https://twitter.com/merdekadotcom/status/1351621708063465472
Mon Jan 18 07:10:48 +0000 2021;1351064482349543427;"Kabar tidak benar alias hoax di media sosial menerpa Kasdim 0817 Gresik Mayor Sugeng Riyadi, Kebomas Kabupaten Gresik yang meninggal usai disuntik vaksin covid-19. https://t.co/ZxAd3oDzo7 #surabaya #beritajatim";0;0;1;0;in;21287066;1351064482349543427;beritajatimcom;https://twitter.com/beritajatimcom/status/1351064482349543427
Sun Jan 17 10:57:37 +0000 2021;1350759173525540865;"#Pemkot Surabaya Terus Sosialisasikan Vaksin Corona, Whisnu: Aman dan Halal - detikNews #Corona #Korona";0;0;0;0;in;705224376422010881;1350759173525540865;Berita_Corona;https://twitter.com/Berita_Corona/status/1350759173525540865
Sat Jan 16 12:30:31 +0000 2021;1350420165507178497;"Danrem 084/Bhaskara Jaya Terima Vaksin Sinovac  Komandan Korem 084/BJ, Brigjen TNI Herman Hidayat Eko Atmojo, bersama Forkopimda Kota Surabaya mendapat kesempatan pertama pelaksanaan vaksinasi Covid-19 yang dilaksanakan di halaman Balai Kota Surabaya, Jum’at (15/01/2021) https://t.co/xUuYdtxrBJ";0;0;0;2;in;904127423888818176;1350420165507178497;Korem084Bj;https://twitter.com/Korem084Bj/status/1350420165507178497
Sat Jan 16 12:01:04 +0000 2021;1350412752846610435;"Arumi Bachsin, istri Wakil Gubernur Jatim Emil Elistianto Dardak akhirnya disuntik vaksin Covid-19, Jumat (15/1/2021), di RSU dr Soetomo Surabaya. https://t.co/gst800p4at";0;0;2;7;in;23343960;1350412752846610435;kompascom;https://twitter.com/kompascom/status/1350412752846610435
Sat Jan 16 08:03:00 +0000 2021;1350352841102258176;"Sebanyak 33.032 tenaga kesehatan di Kota Surabaya Jawa Timur disuntik vaksin. Hal ini dilakukan untuk mencegah bertambahnya tenaga kesehatan yang meninggal setelah terpapar covid-19.  Selengkapnya di: https://t.co/em3fkwXI0o https://t.co/g9VPvqAQf1";0;0;1;6;in;71436318;1350352841102258176;KompasTV;https://twitter.com/KompasTV/status/1350352841102258176
Sat Jan 16 07:14:47 +0000 2021;1350340707429580800;"Ketua DPRD Surabaya: Vaksin Covid-19 aman dan halal via @radiomercury96 https://t.co/UCLZtLUizB";0;0;0;0;in;102267519;1350340707429580800;radiomercury96;https://twitter.com/radiomercury96/status/1350340707429580800
Sat Jan 16 04:08:20 +0000 2021;1350293786518188034;"Sebagai salah satu bentuk dukungan terhadap program Pemerintah untuk mengatasi masalah pandemi Covid-19, Ketua DPRD Kota Surabaya Adi Sutarwijono yang juga merupakan kader PDI Perjuangan, menerima suntikan vaksin Covid-19-  #SayaSiapDiVaksin  #PDIPerjuanganPeduliKesehatan https://t.co/UkOoWpg284";0;3;0;5;in;153407983;1350293786518188034;PDI_Perjuangan;https://twitter.com/PDI_Perjuangan/status/1350293786518188034
Fri Jan 15 16:45:19 +0000 2021;1350121898814922753;"Dampingi Ketua DPRD Surabaya, Wk. Fraksi PKB Suntik Vaksin Covid https://t.co/CZSHTCJTQz";0;0;0;0;in;1297798716133236736;1350121898814922753;MediaNawacita;https://twitter.com/MediaNawacita/status/1350121898814922753
Fri Jan 15 11:37:32 +0000 2021;1350044444960034816;"Gara-gara tensi darah tinggi, Plt Wali Kota Surabaya Whisnu Sakti, nyaris gagal disuntik vaksin dalam Program Vaksinasi Covid-19 di Balai Kota Surabaya, Jumat (15/1/2021). https://t.co/uDpPQUMKGF";0;0;0;0;in;2340155395;1350044444960034816;suaradotcom;https://twitter.com/suaradotcom/status/1350044444960034816
Fri Jan 15 07:17:15 +0000 2021;1349978940866138115;""Arek Suroboyo kudu wani divaksin. Vaksin ini aman dan halal" - Whisnu Sakti Buana, Pelaksana Tugas (Plt) Wali Kota Surabaya  Hari ini (15/1), digelar pencanangan vaksinasi Covid-19 di halaman Balai Kota Surabaya, sebagai salah satu upaya dan ikhtiar dalam menanggulangi Covid-19 https://t.co/X6e1wdXrnt";2;4;6;22;in;288692148;1349978940866138115;SapawargaSby;https://twitter.com/SapawargaSby/status/1349978940866138115
Fri Jan 15 06:46:09 +0000 2021;1349971113976074241;"Sekdaprov Heru  juga memberikan motivasi langsung kepada para calon penerima vaksin di Kota Surabaya dan memastikan bahwa Vaksin Covid-19 ini aman dan halal karena sudah mendapat ijin BPOM dan Sertifikat Halal dari MUI. https://t.co/j8C2b14pJB";0;0;1;3;in;771337601269714944;1349971107944620032;JatimPemprov;https://twitter.com/JatimPemprov/status/1349971113976074241
Fri Jan 15 05:29:18 +0000 2021;1349951775038586880;"Tensi Darah Tinggi, Plt Wali Kota Surabaya Whisnu Sakti Buana Sempat Ditunda Suntik Vaksin Covid-19 https://t.co/9qUY2cMRHQ via @portalsurya";0;0;0;0;in;120097058;1349951775038586880;portalsurya;https://twitter.com/portalsurya/status/1349951775038586880
Fri Jan 15 02:42:46 +0000 2021;1349909865733341185;"Sobat GEN, baru aja Plt. Walikota Surabaya - Wisnu Sakti Buana di suntik vaksin covid-19 di halaman Balai Kota Surabaya.  Siapa nih yang siap di suntik juga??  Sumber : @BanggaSurabaya  #InfoGenWaniPooll #gen1031fmsby  #surabaya #WisnuSaktiBuana #covid_19 https://t.co/Wvn5krxBjV";0;0;0;0;in;124402522;1349909865733341185;gen1031fmsby;https://twitter.com/gen1031fmsby/status/1349909865733341185
Fri Jan 15 02:16:35 +0000 2021;1349903273780625411;"PROSESI PERDANA VAKSINASI COVID-19 DI SURABAYA https://t.co/YpBkalZlOw #surabaya #Vaksin";0;0;0;0;in;21287066;1349903273780625411;beritajatimcom;https://twitter.com/beritajatimcom/status/1349903273780625411
Fri Jan 15 01:06:59 +0000 2021;1349885758715269120;"Wakil Gubernur Jawa Timur Emil Elestianto Dardak dan Sejumlah Pejabat Lainnya Menerima Suntikan Pertama Vaksin Covid-19 di Gedung Negara Grahadi, Surabaya Kamis (14/1/2021).   @JatimPemprov @EmilDardak @KhofifahIP https://t.co/zi3jkF4Fm7";0;0;1;4;in;3104001139;1349885758715269120;humasprovjatim;https://twitter.com/humasprovjatim/status/1349885758715269120
Thu Jan 14 15:47:46 +0000 2021;1349745028164411392;"Pemprov Jatim Distribusikan Vaksin Covid-19 Untuk Surabaya Raya https://t.co/8alaMK69mF";0;0;0;0;in;1297798716133236736;1349745028164411392;MediaNawacita;https://twitter.com/MediaNawacita/status/1349745028164411392
Thu Jan 14 13:03:08 +0000 2021;1349703598528102401;"GTPP COVID-19 Pacitan Masih Tunggu Kedatangan Vaksin dari Surabaya https://t.co/9Ecr2hwXiH";0;0;0;0;in;1394260704;1349703598528102401;Pacitanku;https://twitter.com/Pacitanku/status/1349703598528102401
Thu Jan 14 12:00:00 +0000 2021;1349687709598511105;"Dengan masuknya puluhan ribu dosis vaksin ke Surabaya, maka vaksinasi COVID-19 akan digelar perdana pada Jumat besok. Siapa saja penerimanya? https://t.co/ZrW5t1nhGG  #VaksinCOVID19 #VaksinSurabaya #COVID19Surabaya @infosurabaya https://t.co/RnEXRMIQGV";0;0;0;0;in;1016858721056522240;1349687709598511105;PingPointID;https://twitter.com/PingPointID/status/1349687709598511105
Thu Jan 14 08:30:00 +0000 2021;1349634859686191104;"#InfoGenWaniPooll Dinas Kesehatan Kota Surabaya mencatat, sekitar 1.950.000 warga Surabaya yang berumur 18 sampai 59 tahun, bakal jadi sasaran penerima vaksin COVID-19.";0;0;0;1;in;124402522;1349634859686191104;gen1031fmsby;https://twitter.com/gen1031fmsby/status/1349634859686191104
Thu Jan 14 07:21:18 +0000 2021;1349617570874155008;"Vaksin Covid-19 untuk Surabaya sudah tersimpan di cold room via @radiomercury96 https://t.co/fS0UdVaVwr";0;0;0;0;in;102267519;1349617570874155008;radiomercury96;https://twitter.com/radiomercury96/status/1349617570874155008
Thu Jan 14 03:49:01 +0000 2021;1349564150083514368;"Vaksin Covid-19 Mulai Didistribusi ke Tiga Daerah Surabaya Raya https://t.co/EUcRuxEEhk   #coldstorage #VaksinCorona";0;1;1;1;in;1235597011350519809;1349564150083514368;gudangikan;https://twitter.com/gudangikan/status/1349564150083514368
Thu Jan 14 03:47:47 +0000 2021;1349563840787214337;"Vaksin Covid-19 Mulai Dikirim ke Surabaya Raya, Daerah Lain Tunggu Cold Storage  https://t.co/m9kYngT41u   #vaksin #VaksinCorona #coldstorage";0;0;0;0;in;1235597011350519809;1349563840787214337;gudangikan;https://twitter.com/gudangikan/status/1349563840787214337
Thu Jan 14 02:43:32 +0000 2021;1349547668155019264;"Pemprov Jatim Distribusikan Vaksin Covid-19 Untuk Surabaya Raya https://t.co/YOTBfALZHk";0;0;0;0;in;1175053865047097346;1349547668155019264;MetroTimes_News;https://twitter.com/MetroTimes_News/status/1349547668155019264
Thu Jan 14 01:44:07 +0000 2021;1349532715448639489;"Sobat Jatim,  yuk saksikan Vaksinasi Covid-19 Pertama Kali di Jawa Timur "Vaksin Aman dan Halal" Gedung Negara Grahadi,  Surabaya 14 Januari 2021 https://t.co/pi1wguCyhe";2;0;1;7;in;771337601269714944;1349532715448639489;JatimPemprov;https://twitter.com/JatimPemprov/status/1349532715448639489
Wed Jan 13 14:40:41 +0000 2021;1349365759772749825;"@jcowacko Disurabaya sempet nol gak ada yang kena covid tapi pas waktu mau pilkada, trus skrng pilkada udah kelar denger2 Surabaya ngelonjak lagi smpai sekarang? apa pilkada itu vaksin yang sebenarnya dan gratis tidak memerlukan biaya, malah kita yang dapet uang dari calon pemilihan wkwkwk";0;1;0;0;in;1344773720599003136;1349307802590695426;warwer96594465;https://twitter.com/warwer96594465/status/1349365759772749825
Wed Jan 13 13:25:59 +0000 2021;1349346958662533121;"Pemprov Jatim Distribusikan Vaksin Covid-19 Untuk Surabaya Raya  https://t.co/yR7VQ8Xk8I https://t.co/gPhK6pNOHS";0;0;0;0;in;1287907609891094528;1349346958662533121;Investigasitod1;https://twitter.com/Investigasitod1/status/1349346958662533121
Wed Jan 13 11:50:06 +0000 2021;1349322828764520451;"Vaksin Covid-19 untuk Kota Surabaya sudah diterima oleh Dinas Kesehatan Kota Surabaya @sehatsurabayaku. Para tenaga kesehatan (nakes) akan menjadi penerima vaksin di Tahap Pertama ini  Yang lain kapan min? Tunggu informasinya ya teman2. Pasti akan kami sampaikan lagi nanti 🤗🤗 https://t.co/qPBYsi0mp6";0;1;2;6;in;288692148;1349322828764520451;SapawargaSby;https://twitter.com/SapawargaSby/status/1349322828764520451
Wed Jan 13 11:14:57 +0000 2021;1349313982193037312;"15.000 Vaksin Covid-19 Tiba di Kota Surabaya, Disimpan di Gudang Farmasi Pemkot https://t.co/a2VbYPB1Km via @portalsurya";0;0;0;0;in;120097058;1349313982193037312;portalsurya;https://twitter.com/portalsurya/status/1349313982193037312
Wed Jan 13 10:44:09 +0000 2021;1349306234881511424;"Sekitar 1.950.000 warga Kota Surabaya, dengan usia 18 hingga 59 tahun akan menjadi sasaran calon penerima vaksin COVID-19.  https://t.co/LeL9jQEbZw";0;0;1;3;in;18071520;1349306234881511424;antaranews;https://twitter.com/antaranews/status/1349306234881511424
Wed Jan 13 10:14:38 +0000 2021;1349298806836273153;"#DukungSehatkanBangsa Kanit Binmas Polsek Seputih Surabaya Bripka Kade Agus P, S.H., M.H meajak masyarakat untuk vaksinasi demi memulihkan Indonesia dari pandemi. Selain disiplin protokol kesehatan, vaksin Covid-19 adalah salah satu upaya dan harapan Indonesia bebas dari Covid-19 https://t.co/MI8ZGVhNFR";1;0;0;4;in;923027485435899904;1349298806836273153;Polsek_sebaya;https://twitter.com/Polsek_sebaya/status/1349298806836273153
Wed Jan 13 10:09:06 +0000 2021;1349297413555507202;"#DukungSehatkanBangsa Kapolsek Seputih Surabaya AKP YOFFI KURNIAWAN,  S.E., S.H., M.H meajak masyarakat untuk vaksinasi demi memulihkan Indonesia dari pandemi. Selain disiplin protokol kesehatan vaksin Covid-19 adalah salah satu upaya dan harapan Indonesia terbebas dari Covid-19. https://t.co/87jvJZJ2Uu";1;0;0;4;in;923027485435899904;1349297413555507202;Polsek_sebaya;https://twitter.com/Polsek_sebaya/status/1349297413555507202
Wed Jan 13 09:52:36 +0000 2021;1349293258258620416;"Vaksin Covid-19 Mulai Didistribusi ke Tiga Daerah Surabaya Raya https://t.co/DB3UgN6vFb";0;1;3;3;in;848614550;1349293258258620416;e100ss;https://twitter.com/e100ss/status/1349293258258620416
Wed Jan 13 09:52:13 +0000 2021;1349293163266019329;"Keterbatasan Tempat, Separuh Vaksin COVID-19 Didistribusikan ke Surabaya Raya https://t.co/gaAwIMPoSn";0;0;0;0;in;1234774867704049664;1349293163266019329;telisik_id;https://twitter.com/telisik_id/status/1349293163266019329
Wed Jan 13 09:34:04 +0000 2021;1349288593903165440;"Sebanyak 15 ribu vaksin COVID-19 telah didistribusikan ke wilayah Surabaya Raya, hari ini Rabu (13/1). #publisherstory https://t.co/vLAQxlXmLn";0;0;0;0;in;759692754985242625;1349288593903165440;kumparan;https://twitter.com/kumparan/status/1349288593903165440
Wed Jan 13 07:09:04 +0000 2021;1349252103772884992;"Di Surabaya, vaksin COVID-19 akan disimpan di Gudang Farmasi milik Dinas Kesehatan (Dinkes) Surabaya di Jalan Kalirungkut. #publisherstory https://t.co/qvAbj4FhK8";0;0;1;0;in;759692754985242625;1349252103772884992;kumparan;https://twitter.com/kumparan/status/1349252103772884992
Wed Jan 13 07:08:07 +0000 2021;1349251865272147969;"Vaksin Covid-19 didistribusikan ke Surabaya, Sidoarjo, Gresik. Tapi baru sebagian via @radiomercury96 https://t.co/ekWDt3cjT0";0;0;0;0;in;102267519;1349251865272147969;radiomercury96;https://twitter.com/radiomercury96/status/1349251865272147969
Wed Jan 13 07:04:30 +0000 2021;1349250958035832840;"Kedatangan vaksin ini tiba di gedung Instalasi Farmasi Kota Surabaya, Jl. Kalirungkut Surabaya pukul 11.00 WIB.   Dengan standar operasional prosedur yang ketat, sebanyak 15.000 dosis vaksin COVID-19 tahap pertama ini langsung disimpan di dalam cold storage yang telah disiapkan. https://t.co/Y4wXQ1a7mM";0;1;0;1;in;1232843596342022144;1349250793845579776;sehatsurabayaku;https://twitter.com/sehatsurabayaku/status/1349250958035832840
Wed Jan 13 07:03:51 +0000 2021;1349250793845579776;"Vaksin COVID-19 Tiba di Surabaya  #DulurSehatSby, dengan pengawalan ketat dari Polda Jatim, vaksin COVID-19 telah diterima oleh Pemerintah Kota Surabaya dari Dinas Kesehatan Provinsi Jawa Timur ( @dinkesjatim ), hari Rabu (13/01/2021). https://t.co/vnmTMP1LRc";0;3;22;30;in;1232843596342022144;1349250793845579776;sehatsurabayaku;https://twitter.com/sehatsurabayaku/status/1349250793845579776
Wed Jan 13 04:53:21 +0000 2021;1349217950037725184;"Vaksin Covid-19 Disimpan di Pergudangan UPTD Farmasi Surabaya https://t.co/2ainGv9wxE";0;0;0;0;in;2392460208;1349217950037725184;jawapos;https://twitter.com/jawapos/status/1349217950037725184
Wed Jan 13 01:30:00 +0000 2021;1349166775368364033;"#InfoGenWaniPooll Jubir Satgas COVID-19 Jatim, dr Makhyan Jibril mengatakan, proses vaksinasi di Jawa Timur akan dilakukan di Surabaya Raya (Surabaya, Sidoarjo, dan Gresik), dengan total 48.060 dosis vaksin untuk tahap pertama.";0;0;0;0;in;124402522;1349166775368364033;gen1031fmsby;https://twitter.com/gen1031fmsby/status/1349166775368364033
