created_at;id_str;full_text;quote_count;reply_count;retweet_count;favorite_count;lang;user_id_str;conversation_id_str;username;tweet_url
Tue Jan 12 23:53:33 +0000 2021;1349142504407404545;"Pemkot Surabaya akan menerima 33.420 dosis vaksin COVID-19. Dari angka tersebut, diprioritaskan kepada nakes dengan jumlah 33.027 orang. Sedangkan sisanya untuk tenaga lainnya. #publisherstory https://t.co/cBYzVHDoU4";1;0;0;0;in;759692754985242625;1349142504407404545;kumparan;https://twitter.com/kumparan/status/1349142504407404545
Tue Jan 12 15:48:15 +0000 2021;1349020372985913356;"Kuota Vaksin Covid-19 Kota Malang Terbanyak Kedua Setelah Surabaya https://t.co/FDNHMhoVkc lewat @radar_malang";0;0;0;1;in;1272488557983105024;1349020372985913356;widodowicakson8;https://twitter.com/widodowicakson8/status/1349020372985913356
Tue Jan 12 15:35:35 +0000 2021;1349017186879336453;"Kuota Vaksin Covid-19 Kota Malang Terbanyak Kedua Setelah Surabaya https://t.co/75KeOYUi8P via @radar_malang";0;0;0;0;in;208387256;1349017186879336453;vandicham;https://twitter.com/vandicham/status/1349017186879336453
Tue Jan 12 13:31:12 +0000 2021;1348985884549337091;"Besok Dinkes Surabaya ambil vaksin Covid-19 ke Provinsi Jatim via @radiomercury96 https://t.co/espgzkpN2y";1;0;0;0;in;102267519;1348985884549337091;radiomercury96;https://twitter.com/radiomercury96/status/1348985884549337091
Tue Jan 12 12:26:28 +0000 2021;1348969595747504128;"Jadwal dan Jatah Dosis Vaksin Covid-19 Jatim Mulai Disusun, Surabaya Gresik dan Sidoarjo Prioritas https://t.co/ZkgYxDBMpW via @suryamalangcom";0;0;0;0;in;1345998765086314496;1348969595747504128;suryamalangcom;https://twitter.com/suryamalangcom/status/1348969595747504128
Tue Jan 12 12:04:53 +0000 2021;1348964163935080450;"Ini Jatah Vaksin Covid-19 untuk Wilayah Surabaya, Gresik dan Sidoarjo https://t.co/HDLJuN3Dcf via @portalsurya";0;0;0;0;in;120097058;1348964163935080450;portalsurya;https://twitter.com/portalsurya/status/1348964163935080450
Tue Jan 12 10:40:16 +0000 2021;1348942867427807232;"Kuota Vaksin Covid-19 Kota Malang Terbanyak Kedua Setelah Surabaya https://t.co/c3yzhTlBtf lewat @radar_malang";0;0;0;1;in;1272464123368890368;1348942867427807232;DidikPras17;https://twitter.com/DidikPras17/status/1348942867427807232
Tue Jan 12 10:13:57 +0000 2021;1348936245485871105;"Surabaya Dapat Jatah 33.420 Vaksin Covid-19 Gelombang Pertama https://t.co/zf7eM9SKf2";0;0;3;5;in;848614550;1348936245485871105;e100ss;https://twitter.com/e100ss/status/1348936245485871105
Tue Jan 12 10:08:56 +0000 2021;1348934980722946048;"Plt Surabaya Whisnu Sakti Buana meminta tambahan 8.000 lebih vaksin COVID-19 sinovac. Ini dilakukan untuk tenaga publik. Seperti polisi-TNI, Satpol PP, Linmas. https://t.co/LnGxMwn1Jh";0;0;1;3;in;69183155;1348934980722946048;detikcom;https://twitter.com/detikcom/status/1348934980722946048
Tue Jan 12 09:19:02 +0000 2021;1348922424717422592;"33.420 Vaksin COVID-19 Sinovac akan didistribusikan di Kota Surabaya. Puluhan ribu itu jatah vaksin yang diberikan dari Dinas Kesehatan (Dinkes) Jatim. https://t.co/z0W1G9zaWH";0;0;1;7;in;69183155;1348922424717422592;detikcom;https://twitter.com/detikcom/status/1348922424717422592
Tue Jan 12 07:58:44 +0000 2021;1348902217500119041;"Hilangkan Keraguan, Pemkot Surabaya Ajukan 12 Penerima Vaksin Covid-19 https://t.co/k50BE8IAcb";0;0;0;1;in;2392460208;1348902217500119041;jawapos;https://twitter.com/jawapos/status/1348902217500119041
Tue Jan 12 07:18:43 +0000 2021;1348892148079366149;"Gubernur Jawa Timur, Khofifah Indar Parawansa kembali meyakinkan masyarakat bahwa vaksin Covid-19 SINOVAC aman dan halal. https://t.co/F6H8L984nF #beritajatim #surabaya";0;0;0;0;in;21287066;1348892148079366149;beritajatimcom;https://twitter.com/beritajatimcom/status/1348892148079366149
Tue Jan 12 06:50:37 +0000 2021;1348885075052482562;"Vaksin Covid-19, Pemprov Prioritaskan Surabaya, Gresik, dan Sidoarjo https://t.co/zlYT95z0AE";0;0;0;3;in;2392460208;1348885075052482562;jawapos;https://twitter.com/jawapos/status/1348885075052482562
Mon Jan 11 23:38:33 +0000 2021;1348776339877232640;"Eh sobat GEN ternyata kotak distribusi vaksin covid-19 yang bikin anak Surabaya lho!!!  Nah besok kenalan yok sama Adrian Fadhillah, Mahasiswa @ITS_campus yang bikin VD Box, dengerin #SemangatPagiWaniPooll bareng @Chokyyy @vinnachristie jam 6 pagi tetttt!!!  #gen1031fmsby https://t.co/ILQxt0Jaz6";0;0;3;3;in;124402522;1348776339877232640;gen1031fmsby;https://twitter.com/gen1031fmsby/status/1348776339877232640
Mon Jan 11 12:16:19 +0000 2021;1348604651310964738;"Eh sobat GEN ternyata kotak distribusi vaksin covid-19 yang bikin anak Surabaya lho!!!  Nah besok kenalan yok sama Adrian Fadhillah, Mahasiswa @ITS_campus yang bikin VD Box, dengerin #SemangatPagiWaniPooll bareng @Chokyyy @vinnachristie jam 6 pagi tetttt!!!  #gen1031fmsby https://t.co/O4Tu6Uwlaf";0;0;0;0;in;124402522;1348604651310964738;gen1031fmsby;https://twitter.com/gen1031fmsby/status/1348604651310964738
Sun Jan 10 04:39:42 +0000 2021;1348127350496534528;"Besok RSUD Dr Soetomo Surabaya Gelar Simulasi Vaksinasi Covid-19  Vaksin vaksinasi https://t.co/DtiSQeYYj3   Download aplikasi Tribunnews untuk update berita terbaru    Dapatkan untuk Android:  https://t.co/eJLM0Cw75h    lewat @tribunnews";0;0;0;0;in;344601410;1348127350496534528;dosopriyanto;https://twitter.com/dosopriyanto/status/1348127350496534528
Sun Jan 10 01:07:51 +0000 2021;1348074038527021058;"POLDA JATIM - Pastikan Keamanan Vaksin Covid-19, Kapolda Jatim Tinjau Tempat Penyimpanan Vaksin di Dinkes  Kapolda Jawa Timur (Jatim), Irjen. Pol. Dr. Nico Afinta, S.I.K., S.H., M.H.,  meninjau lokasi penyimpanan vaksin Covid-19 di Dinas Kesehatan (Dinkes) Jatim di Surabaya. https://t.co/o3E05KR80u";0;4;17;79;in;138290629;1348074038527021058;DivHumas_Polri;https://twitter.com/DivHumas_Polri/status/1348074038527021058
Sat Jan 09 18:02:37 +0000 2021;1347967024140529667;"Ketua Komisi D : Pemkot Surabaya Sudah Ajukan 2 Juta Vaksin Covid https://t.co/dh8Win7Kk2";0;0;0;0;in;1297798716133236736;1347967024140529667;MediaNawacita;https://twitter.com/MediaNawacita/status/1347967024140529667
Fri Jan 08 04:02:47 +0000 2021;1347393286185517056;"Pemerintah Kota Surabaya yang mengajukan permohonan vaksin Covid-19 untuk sekitar 1,9 juta berusia 18-59 tahun. Namun jatah jumlah vaksin untuk tiap kabupaten masih dalam pembahasan meski vaksin untuk Jawa Timur sudah tiba Senin lalu.  #CNNIDAfter10 https://t.co/ns6OyEyJew https://t.co/jbsW05llLA";0;0;1;1;in;3306771829;1347393286185517056;CNNIDdaily;https://twitter.com/CNNIDdaily/status/1347393286185517056
Thu Jan 07 10:05:20 +0000 2021;1347122135714721792;"Hitungan Pemerintah Kota, Surabaya Butuh 3,8 Juta Dosis Vaksin Covid-19 https://t.co/zgA1D5RUy5 #Berita #Terkini #News #beritajatim #Jatim";0;0;0;0;in;21287066;1347122135714721792;beritajatimcom;https://twitter.com/beritajatimcom/status/1347122135714721792
Thu Jan 07 03:53:13 +0000 2021;1347028490499944451;"[2] BPOM untuk #vaksinSinovac ini belum ada.  Kombespol Johnny Eddizon Isir, Kapolrestabes #Surabaya mengatakan personel gabungan yang terdiri dari Brimob, #PoldaJatim &amp  #PolrestabesSurabaya siaga 24 jam untuk mengamankan vaksin Covid-19 di gudang penyimpanan Dinkes Jatim.";0;1;0;0;in;100132119;1347028402419601409;radiopatria;https://twitter.com/radiopatria/status/1347028490499944451
Wed Jan 06 19:33:32 +0000 2021;1346902743273730048;"Pemkot Surabaya Pakai Aplikasi Pencatatan Vaksinasi Covid-19: Kepala Dinas Komunikasi dan Informatika (Diskominfo) Kota Surabaya, M. Fikser mengatakan, aplikasi ini untuk memudahkan petugas melaksanakan vaksinasi dengan harapan warga penerima vaksin itu… https://t.co/yrMTYLHicZ";0;0;0;0;in;456426648;1346902743273730048;merdekadotcom;https://twitter.com/merdekadotcom/status/1346902743273730048
Wed Jan 06 17:40:39 +0000 2021;1346874331800850435;"DPRD Surabaya: Pemkot Harus Edukasi Warga soal Vaksin Covid-19 https://t.co/JPP2mDqfHz https://t.co/jH61VeW0jI";0;0;0;0;in;2251383210;1346874331800850435;AhmadNorMaulana;https://twitter.com/AhmadNorMaulana/status/1346874331800850435
Wed Jan 06 15:55:22 +0000 2021;1346847838244896769;"Pemkot Surabaya Ajukan 2 Juta Vaksin Covid-19 #AksesVaksinCovid19 #KetuaKomisiDDPRDSurabaya #KhusnulKhotimah #pemkotsurabaya #VaksinasiCovid19 #WhisnuSaktiBuana  https://t.co/fO1tjs94xO https://t.co/E3aQJ0ESFe";0;0;0;0;in;816345224037343232;1346847838244896769;superradioid;https://twitter.com/superradioid/status/1346847838244896769
Wed Jan 06 15:02:51 +0000 2021;1346834620717920256;"Pengawasan Mutu Vaksin Covid-19 Terapkan Standar Internasional https://t.co/oO6MjtdDyS  #vaksin #vaksìncovid19 #covid_19 #standard #international #berita #news #pustakalewi @ Surabaya, Indonesia https://t.co/RhQuT718tx";0;0;0;0;in;425674774;1346834620717920256;mwpattikawa;https://twitter.com/mwpattikawa/status/1346834620717920256
Wed Jan 06 14:16:37 +0000 2021;1346822987434004480;"PEMKOT SURABAYA SIAP SIAP VAKSIN COVID-19 ??? PANDEMI CORONAVIRUS COVID-19 akan berakhir... https://t.co/B6HwXg9Qri";0;0;0;0;in;118056348;1346822987434004480;arifluqmanngaji;https://twitter.com/arifluqmanngaji/status/1346822987434004480
Wed Jan 06 13:56:32 +0000 2021;1346817931674488837;"Pemkot Surabaya Sediakan 2 Cool Room untuk Penyimpanan Vaksin Covid-19 https://t.co/AXpxDf7hmY";0;0;0;0;in;2392460208;1346817931674488837;jawapos;https://twitter.com/jawapos/status/1346817931674488837
Wed Jan 06 13:19:05 +0000 2021;1346808510105800704;"Pemkot Surabaya Ajukan 2 Juta Dosis Vaksin COVID-19 ke Pemerintah Pusat https://t.co/z6a2LawvT2";0;0;0;0;in;1285016293;1346808510105800704;Pemuda_Depok;https://twitter.com/Pemuda_Depok/status/1346808510105800704
Wed Jan 06 11:32:03 +0000 2021;1346781571601244161;"Vaksin Covid-19 Sampai di Surabaya, Dandim 0818 Siap Amankan Distribusi di Kabupaten Malang https://t.co/L6XER0WGmd #malangtimes #beritamalang";0;0;0;1;in;2519948221;1346781571601244161;jatimtimescom;https://twitter.com/jatimtimescom/status/1346781571601244161
Wed Jan 06 08:36:39 +0000 2021;1346737431643521024;"Pemkot Surabaya ajukan 2 juta dosis vaksin COVID-19.  https://t.co/LTqa1bGxP2 https://t.co/gadhJDZn4K";0;0;0;2;in;121640063;1346737431643521024;RadioElshinta;https://twitter.com/RadioElshinta/status/1346737431643521024
Wed Jan 06 07:41:34 +0000 2021;1346723570198540289;"Pemkot Surabaya ajukan 2 juta dosis vaksin COVID-19 https://t.co/8El6JzWxRL https://t.co/wd33Ppc9l0";0;0;1;0;in;205287653;1346723570198540289;ElshintaDotcom;https://twitter.com/ElshintaDotcom/status/1346723570198540289
Wed Jan 06 06:47:19 +0000 2021;1346709915012775936;"Pemkot Surabaya Ajukan 2 Juta Dosis Vaksin Covid ke Pemerintah Pusat https://t.co/gi6jqXBh0p";0;0;0;0;in;2392460208;1346709915012775936;jawapos;https://twitter.com/jawapos/status/1346709915012775936
Wed Jan 06 06:17:32 +0000 2021;1346702421196566528;"Sebanyak 77.760 dosis vaksin Sinovac untuk menangani COVID-19 yang saat ini tersimpan di kantor Dinas Kesehatan (Dinkes) Jatim, di Jalan A Yani, Surabaya. #publisherstory https://t.co/SjhoYmmbii";0;0;0;0;in;759692754985242625;1346702421196566528;kumparan;https://twitter.com/kumparan/status/1346702421196566528
Wed Jan 06 03:44:06 +0000 2021;1346663807800598528;"Lebih dari 38 ribu tenaga medis dan tenaga kesehatan di Jawa Timur akan menjadi penerima vaksin pertama setelah vaksin tiba Senin (4/1) lalu. Di Surabaya, ada 29 rumah sakit yang ditunjuk sebagai tempat pemberi vaksin Covid-19.  #CNNIDAfter10 https://t.co/ns6OyEyJew https://t.co/NCWBevbGBD";0;0;1;1;in;3306771829;1346663807800598528;CNNIDdaily;https://twitter.com/CNNIDdaily/status/1346663807800598528
Tue Jan 05 13:14:02 +0000 2021;1346444850506289152;"Tiba di Surabaya, Pemkab Malang Siapkan Cold Storage untuk Penyimpanan Vaksin Covid-19 https://t.co/SE70HY3DJ8 #malangtimes #beritamalang";0;0;0;2;in;2519948221;1346444850506289152;jatimtimescom;https://twitter.com/jatimtimescom/status/1346444850506289152
Tue Jan 05 07:12:36 +0000 2021;1346353891252715522;"#RadioKARIMATA 14.11 Dinas Kesehatan Kabupaten Pamekasan belum terima Vaksin Covid-19 produksi Sinovac yang tiba di Kantor Dinas Kesehatan Provinsi Jawa Timur, Jl. Ahmad Yani, Surabaya pada Senin (04/01/2021) Kemarin. (Pnc) https://t.co/WkZdvTQX9s";0;0;0;0;in;1123789453;1346353891252715522;karimatafm1033;https://twitter.com/karimatafm1033/status/1346353891252715522
Tue Jan 05 06:28:18 +0000 2021;1346342741697970177;"Update Virus Corona di Surabaya 5 Januari: Positif Covid-19 Tambah 61 dan Vaksin Dikabarkan Tiba https://t.co/muqXENtLuE via @portalsurya";0;0;0;0;in;120097058;1346342741697970177;portalsurya;https://twitter.com/portalsurya/status/1346342741697970177
